title,company,industry,seniority,min,max,skills,description,location,source,posted,url
"🛏️ Product Manager (Mattress / Home Furnishing | Up to $6,500 | Regional Exposure)",SRG INTERNATIONAL EMPLOYMENT AGENCY PTE. LTD.,Design / Engineering / Manufacturing / Sciences / Laboratory / R&D / Precision Engineering,Manager,5500,6500,Construction;Strong Attention To Detail;product roadmap strategies;Product Design;scientific discipline;Product Lifecycle Management;market research techniques;Project Management;Sleep Medicine;Product Development;Product Improvement,"🛏️ Product Manager (Mattress / Home Furnishing | Up to $6,500 | Regional Exposure) 💰 $5,500 – $6,500 per month | 5 Days Work Week Company SRG International Employment Agency Pte Ltd (Recruitment Agency – Hiring on behalf of our client) Job Description Our client is an established international company in the mattress and home furnishing industry with a strong focus on innovation, product quality, and market growth. We are seeking an experienced and commercially driven Product Manager to oversee the end-to-end product lifecycle, from concept development and material selection to product launch and post-market performance. This role may also be suitable for candidates with experience or interest in positions such as Product Development Manager, Product Executive, Product Designer, or Category Manager (Home Furnishing / Bedding) . Candidates with experience in mattress, bedding, furniture, consumer products, or home furnishing industries are encouraged to apply. Key Responsibilities Product Development & Lifecycle Management Lead product development from concept creation to commercial launch Define product specifications including materials, construction, design, durability, and qua",Islandwide,MyCareersFuture MCF-2026-0823781,2026-06-14,https://www.mycareersfuture.gov.sg/job/design/%F0%9F%9B%8F%EF%B8%8F-product-manager-srg-international-employment-agency-836a0d1016b87eefdbbd60ea85bafaad
Product Manager (Robotics & Embodied AI),AUTOLIFE ROBOTICS PTE. LTD.,Information Technology,Manager,4000,7000,Vision Systems;product roadmap strategies;Product Requirements;Product Stewardship;Computer Hardware;Computer Science;Teaching Experience;Customer Requirements Analysis;Customer Service,"Product Manager (Robotics & Embodied AI) Position Overview： Autolife Robotics is seeking a highly motivated Product Manager to drive the development and commercialization of next-generation embodied AI and humanoid robotics solutions. This role requires a strong blend of customer insight, technical understanding, and product ownership. You will work closely with customers, engineering teams, and management to transform real-world operational challenges into scalable robotic products that deliver measurable business value. The ideal candidate enjoys engaging directly with customers, understands the practical limitations of robotics technology, and is passionate about bringing innovative products from concept to deployment. Key Responsibilities： 1. Customer Discovery & Requirement Analysis Engage with customers across various industries such as hospitality, retail, logistics, education, property management, and manufacturing. Identify operational pain points and translate ambiguous business needs into clear and actionable product requirements. Discover both explicit and latent customer needs through site visits, interviews, and workflow analysis. Evaluate requirements from technical,","D07 Middle Road, Golden Mile",MyCareersFuture MCF-2026-1007664,2026-06-14,https://www.mycareersfuture.gov.sg/job/information-technology/product-manager-autolife-robotics-b9df72ecaf1c0c4c13a21a82a31310a7
Business Analyst- Transaction Banking/Cash management/ Payments- Japanese speaking,SNAPFIND TALENT SOLUTIONS PTE. LTD.,Banking and Finance,Mid,9000,13000,Issue Management;Payment Processing;banking services;Project Planning;Transaction Banking;“gap-fit” analysis;Cash Management;Banking;Consulting,"Job type- Permanent with Client Responsibilities: Provide system enhancement support by following up progress with Head Office and Singapore, giving feedback, and supporting QA. Handle customer migration by making announcements, explaining data format requirements, and arranging penny tests. Manage interbank data exchange area migration by announcing to banks, clarifying data format requirements, and coordinating penny tests. Oversee overall task progress and resolve issues. Review To-Be plan documents in the project. Conduct Fit-Gap analysis. Define requirements from a Transaction Banking business perspective, summarize them, and provide feedback to the team. Arrange and lead internal and inter-departmental discussions with client departments. Collaborate with team members assigned to the project. Requirements: Bachelor's degree in any related fields. Minimum with 5-8 years proven consulting or Business Analyst experience in a reputable or established consulting firm. Experience working and supporting client’s banking system projects is highly preferred. Experience as a Business Analyst or Consultant in banking, specifically in payments or transaction banking (cash management). St",Islandwide,MyCareersFuture MCF-2026-1003716,2026-06-12,https://www.mycareersfuture.gov.sg/job/banking-finance/business-analyst-transaction-bankingcash-management-payments-japanese-speaking-snapfind-talent-solutions-c63eac785703ac76c2b4b72be163a070
Data Analyst & Marketing Officer,RECRUIT NOW SINGAPORE PTE. LTD.,Others,Junior,3000,3500,Tableau;Sales Support;Data Analysis;B2B Marketing;Automation Studio;Marketing;Data Science;updating datas;Power BI;Research,"Up till $3,500 Basic + Bonus 5 days work week No experience welcomed Our Client, a leading supplier of sensors, measuring systems, laser markers, microscopes, and machine vision systems worldwide, is inviting qualified candidates to fill the position as Data & Marketing Officer. RESPONSIBILITIES: A chance to make a significant impact with your data analysis skills from the very beginning, increasing company performance Creating data to serve as a foundation for sales analysis and market development using software from Microsoft, SAP, and Keyence’s own software Not just updating existing data, but using it to guide sales direction and actions In the Marketing department, tasks include promotional actions, lead generation, and contributing to sales strategies. This position is suitable for those eager to gain a wide range of experiences in all B2B marketing initiatives REQUIREMENTS: Degree in Marketing, Business and Engineering At least 1 year of relevant experience No experience are welcomed to apply No data analysis experience is fine as long willing to learn Must possess proficiencies in Excel and PBI/Tableau. Power Automate will be a plus",Islandwide,MyCareersFuture MCF-2026-0997244,2026-06-12,https://www.mycareersfuture.gov.sg/job/others/data-analyst-marketing-officer-recruit-now-singapore-7b7120bd152244f5f009eb70b03ff5c9
"Data Scientist, Integrated Business Planning",AGILENT TECHNOLOGIES SINGAPORE (INTERNATIONAL) PTE. LTD.,Sciences / Laboratory / R&D,Senior,7000,11000,Dashboards;Graduate Engineering;Governance;Computer Science;SQL;Demand Supply Planning;Statistics;Data Science;business forums,"Job Description Integrated Business Planning (IBP) brings together forecasting and supply planning across marketing, sales, finance, procurement, manufacturing, and customer service into a unified process. This integration ensures alignment across the enterprise, leading to superior customer outcomes. Agilent is building our enterprise planning capabilities to drive IBP across the business by establishing a centralized Planning Excellence Team (PET). This team will continue our Ignite IBP transformation journey which will strengthen our competitive advantage by enabling faster, more reliable planning. The IBP Data Scientist role will bring key data scientist capabilities to the PET team. As the IBP Data Scientist , you will be responsible for supporting the fast-paced development and continued maintenance of demand, inventory, and supply planning models, refreshing targets, and monitoring key planning parameters to ensure the business is positioned to meet demand reliably and efficiently. Principle Duties/Responsibilities: Provide data-driven insights, dashboards, and scenario modeling to support demand and supply planners, S&OE/S&OP processes, and enterprise decision-making Drive ","D27 Sembawang, Yishun",MyCareersFuture MCF-2026-1001928,2026-06-12,https://www.mycareersfuture.gov.sg/job/sciences/data-scientist-integrated-business-planning-agilent-technologies-singapore-6b59317261fbbabbc7c310be4598d09e
Day 2 Software Engineer (AMK),MAESTRO HUMAN RESOURCE PTE. LTD.,Information Technology,Junior,5000,6500,Collaboration;maintaining quality documentation;Customer Support;Problem Analysis;Documentation;Software Engineering;Operational Delivery Teams;Computer Science;Performance Management;Code fixes,"As a Day 2 Software Engineer, you will be responsible for ensuring the smooth operation of our software products post-deployment. Your role will involve not only fixing coding bugs but also performing end-to-end troubleshooting to identify and resolve issues related to configuration, performance, and integration. You will work closely with cross-functional teams to ensure our software meets the highest standards of quality and reliability. Key Responsibilities: - End-to-End Troubleshooting: Perform comprehensive troubleshooting to diagnose and fix issues related to software configuration, performance, and integration. - Bug Fixing: Identify, analyze, and resolve coding bugs in a timely manner. - App Configuration Management: Review and update app configurations to ensure optimal performance and compatibility. - Integration Support: Assist in resolving integration issues with other systems and platforms. - Customer Support: Provide technical support to customers and address their concerns effectively. - Documentation: Maintain detailed documentation of issues, solutions, and best practices. - Collaboration: Work closely with development, QA, and support teams to ensure seamless soft",Islandwide,MyCareersFuture MCF-2026-0811137,2026-06-12,https://www.mycareersfuture.gov.sg/job/information-technology/day-2-software-engineer-maestro-human-resource-37cfb04648fb6e31bc67b72a253afcd0
Game Data Analyst,OAKEVER GAMES PTE. LTD.,Design / Information Technology,Mid,10000,13000,Tableau;Wealth Management;Machine Learning;Data Analysis;Mathematics;Casual Games;Economics;Data Mining;SQL;Statistics,"Responsibilities： Take full ownership of the comprehensive data analysis for core game products. From business and product perspectives, leverage data to identify game issues and bottlenecks, deliver actionable insights, and drive game optimization initiatives. Track the progress of A/B experiments, ensure the reliability and validity of experiment results, and provide targeted recommendations for product iteration. Apply machine learning algorithms to analyze user behavior data, optimize the user lifecycle funnel, and achieve user growth targets. Institutionalize analytical frameworks and methodologies, and deliver analysis templates or requirements for data products Qualifications： Bachelor’s degree or above in Computer Science, Mathematics, Statistics, Economics, Finance, Physics, Communications Engineering or related disciplines. Proficiency in full-spectrum SQL skills, especially window functions; ability to apply common machine learning algorithms in Python/R to solve modeling problems. Solid foundation in statistics, with a clear understanding of the application of statistical methods in A/B experiments. Exceptional self-motivation, self-learning capability, logical thinking","D09 Cairnhill, Orchard, River Valley",MyCareersFuture MCF-2026-0997736,2026-06-12,https://www.mycareersfuture.gov.sg/job/design/game-data-analyst-oakever-games-871b2e823eb4818535982eb59d28a761
Product Manager – Apparel & Accessories,SHEIN STAR PTE. LTD.,Logistics / Supply Chain / Marketing / Public Relations / Purchasing / Merchandising / Sales / Retail,Manager,5000,6000,Market Research;seasonal assortments;Apparel Sourcing;Consumer Insight;Quality Assurance;scalable solutions;Ladies fashion wear;Category Management;Merchandising;Procurement;Inventory Management;Fashion,"Role Overview Join us as a Product Manager – Apparel &Accessories, accountable for driving the strategy, development, assortment, and commercial performance of apparel and accessories categories across our portfolio of emerging consumer brands. The Product Manager is responsible for defining category strategy and leading the end-to-end lifecycle of apparel and accessories products—from consumer and market insights, trend intelligence, assortment planning, and sourcing strategy through product development, commercialization, and lifecycle management. Focused on global growth, particularly in North America and Europe, the role drives commercially successful assortments that deliver revenue growth, GMV, margin expansion, inventory productivity, and exceptional customer value. Collaborate closely with Graphic Design, Marketing, Operations, Supply Chain, and Procurement to develop category-leading apparel and accessories assortments that balance consumer appeal, commercial performance, quality, and operational excellence. Leverage data-driven practices to accelerate speed-to-market and deliver scalable products that drive profitable growth. To success in this role requires hands-on and ","D01 Marina, Raffles Place, People's Park, Cecil",MyCareersFuture MCF-2026-1002072,2026-06-12,https://www.mycareersfuture.gov.sg/job/logistics/product-manager-%E2%80%93-apparel-accessories-shein-star-ab3bc86c20af766934980ae954bdfc2e
Salesforce Data Analyst,CAPGEMINI SINGAPORE PTE. LTD.,Consulting / Information Technology,Junior,4500,6000,JSON;Data Mapping;Data Modelling;Salesforce;MuleSoft;API;Testing,"About Capgemini Capgemini is an AI-powered global business and technology transformation partner, delivering tangible business value. We imagine the future of organizations and make it real with AI, technology and people. With our strong heritage of nearly 60 years, we are a responsible and diverse group of over 420,000 team members in more than 50 countries. We deliver end-to-end services and solutions with our deep industry expertise and strong partner ecosystem, leveraging our capabilities across strategy, technology, design, engineering and business operations. The Group reported 2025 global revenues of €22.5 billion. About the role We are seeking a Salesforce Data Analyst to support large-scale system integration projects involving Salesforce and multiple external systems. You will start by assisting in data mapping and integration work between Salesforce and APIs (e.g. MuleSoft), gaining hands‑on exposure to how data flows across systems. This includes understanding Salesforce data models, integration payloads, and transformation logic. You will also support testing activities (SIT/UAT) and work closely with experienced consultants across Salesforce, integration, and function","D01 Marina, Raffles Place, People's Park, Cecil",MyCareersFuture MCF-2026-0998249,2026-06-12,https://www.mycareersfuture.gov.sg/job/consulting/salesforce-data-analyst-capgemini-singapore-0e934c4d7e1d9b51dfea965bb8ab4404
Senior Commercial Product Manager (B2B),GREATERHEAT PTE. LTD.,Consulting / Information Technology / Others,Senior,8000,12000,Business Design;Roadmap;SKU Management;business management experience;Sales Growth;Pricing Strategy;Cross-functional Coordination;Marketing;B2B;Product Management;Market Intelligence;Record Of Success,"Senior Commercial Product Manager (B2B) A senior product manager role for someone who can shape how our AI capabilities reach the market - through pricing, packaging, and a partner-driven distribution model. The Opportunity We are a Singapore-headquartered B2B AI company building a platform that modernizes trademark and intellectual property work across APAC. Our customers include sophisticated, multi-stakeholder audiences in the IP space, served both directly and through trusted partners. Our AI platform is moving fast. What we are now investing in is how that platform gets to market: how it is priced, how it is packaged, and how our partner ecosystem becomes a real lever for growth - not just a sales channel. This role exists to design that side of the business end to end. You will not inherit a playbook; you will write it. What success looks like You will own the commercial fabric that connects our AI capabilities to revenue.Specifically: how we price, how we package, how our partner relationships a restructured, the surfaces that partners and customers use, and the metrics tree that lets us prove the whole system is working. You will not just run a roadmap. You will own a busin","D01 Marina, Raffles Place, People's Park, Cecil",MyCareersFuture MCF-2026-0999289,2026-06-12,https://www.mycareersfuture.gov.sg/job/consulting/senior-commercial-product-manager-greaterheat-eb60ffa15c787b849cacd8dce65de486
SENIOR DATA SCIENTIST,Land Transport Authority of Singapore,Information Technology / Public / Civil Service,Senior,3700,7400,Time Series Analysis;Condition Monitoring;ETL;Databricks;Data Engineering;SQL;business case presentations;Anomaly Detection;Data Science;Candidate Assessment,"The Rail Digitalisation Division is a cross-functional andmulti-disciplinary team set up to drive and deliver LTA’s Railway CommonData Platform (CDP) , which includes data analytics and artificialintelligence capabilities to support rail performance andoperational/maintenance enhancements. You will be responsible for building the""intelligence layer"" of the CDP, developing systems that not onlydetect anomalies in complex railway time-series data but also reason about themto provide clear, actionable outcomes for maintenance and operations. We are seeking a Senior Data Scientist who excels at convertinguse cases into a data problem and analyzing data to generate value to supportdecision making. You should have a proven track record of deliveringend-to-end machine learning solutions—from data discovery and featureengineering to model deployment and monitoring. The ideal candidate balancesdeep technical expertise with a value-driven mindset, ensuring that analyticaloutputs directly translate to better cost efficiency and improved commuter experience.A degree in Data Science, Statistics, Computer Science, Engineering, or arelated quantitative field is required. Technical Skills Modeling",D08 Little India,MyCareersFuture MCF-2026-0997307,2026-06-12,https://www.mycareersfuture.gov.sg/job/information-technology/senior-data-scientist-land-transport-authority-singapore-72125bc00acc078cff2bc33b222fdf37
Server Product Manager and Channel Operation,FPT ASIA PACIFIC PTE. LTD.,Information Technology,Senior,4500,6000,Channel Management;Self-Service Portfolio;ERP;Computer Science;Product Management;Management Control;Partner Marketing;Product Lifecycle;Pre Post Sales Product Support;Software Development;Infrastructure Support;Management,"We are seeking a Server Product Manager (Channel Focus) to drive product strategy and channel growth across enterprise and infrastructure markets. This is a hybrid role combining product management and channel operations , responsible for developing server product offerings while building and enabling a strong partner ecosystem across industries such as government, enterprise, cloud, and data centres. The role serves as a key bridge between product teams and channel partners , ensuring alignment of product strategy, market demand, and sales execution. Key Responsibilities 1. Product Management (Server Portfolio) Define and manage server product roadmap (rack, high-density, edge, AI servers) based on market demand and partner feedback Develop product specifications, configurations, pricing, and packaging strategies Manage end-to-end product lifecycle (GTM, enhancements, and retirement) Conduct competitive analysis (products, pricing, channel strategies) and define differentiation plans Develop product materials (whitepapers, manuals, value propositions) to support internal and partner teams 2. Channel Development & Operations Build and expand channel ecosystem (distributors, reselle","D12 Toa Payoh, Balestier, Serangoon",MyCareersFuture MCF-2026-1000192,2026-06-12,https://www.mycareersfuture.gov.sg/job/information-technology/server-product-manager-channel-operation-fpt-asia-pacific-70aa1fa11b1d05f7b5998f47dd6d8519
Staff Software Engineer - Digital Economy Products,GOVERNMENT TECHNOLOGY AGENCY,Information Technology,Lead,13000,18000,Mentoring;Code Review;Collaboration;Strong Attention To Detail;Analytical Skills;Software Engineering;Application Development;Implementing Web Applications;Information Technology;Technical Architecture,"[What the role is] GovTech is the lead agency driving Singapore’s Smart Nation initiatives and public sector digital transformation. As the Centre of Excellence for Infocomm Technology and Smart Systems (ICT & SS), GovTech develops the Singapore Government’s capabilities in Data Science & Artificial Intelligence, Application Development, Smart City Technology, Digital Infrastructure, and Cybersecurity. At GovTech, we offer you a purposeful career to make lives better, where we empower our people to master their craft through robust learning and development opportunities all year round. Play a part in Singapore’s vision to build a Smart Nation and embark on your meaningful journey to build tech for public good. Join us to advance our mission and shape your future with us today! Learn more about GovTech at tech.gov.sg [What you will be working on] About DEP: Digital Economy Products (DEP) is a division within GovTech running like a modern product organisation, solving important underserved problems spanning across Healthcare, Manpower, Trade-Industry-Finance, National Development, and Sustainability sectors. We are seeking experienced Staff/Senior Software Engineers to lead one or mo","D05 Pasir Panjang, Hong Leong Garden, Clementi New Town",MyCareersFuture MCF-2026-1002876,2026-06-12,https://www.mycareersfuture.gov.sg/job/information-technology/staff-software-engineer-digital-economy-products-government-technology-agency-3f3baab7ed3017b3d7a69fb5b9ed0de5
"Business Analyst, Attractions Operations",GOLDTECH RESOURCES PTE LTD,Hospitality / Information Technology,Junior,4500,6500,Business Requirements Document;Functional Requirement Specification;application troubleshooting;Operations Management;Systems Integration;technical analysis and troubleshooting;Stakeholder Engagement;Enterprise Systems;Application Support Management;Production Support,"Job Overview We are seeking a Business Analyst to support operational systems and business processes within a large-scale attractions and entertainment environment. This role focuses on system enhancements, operational support, issue analysis, and process improvement initiatives across attractions-related applications and platforms. The ideal candidate should possess strong operational understanding together with hands-on experience working with business users, technical teams, and vendors to support day-to-day operations and system delivery. Key Responsibilities Business Analysis & Requirement Gathering Engage stakeholders to gather, analyze, and document business and operational requirements Translate operational needs into functional specifications and process workflows Conduct impact analysis for system enhancements and operational changes Facilitate discussions between operations users and technical teams Operations Systems Support Support attractions operational systems and related business applications Analyze and troubleshoot system and operational issues Support ticketing, guest operations, scheduling, access control, or related operational workflows Ensure operational pro",Islandwide,MyCareersFuture MCF-2026-0990550,2026-06-11,https://www.mycareersfuture.gov.sg/job/hospitality/business-analyst-attractions-operations-goldtech-resources-2cc2739f9f9a7bf3462ff1b20edf5e27
