title,company,industry,seniority,min,max,skills,description,location,source,posted,url
Data Analyst - Tableau/PowerBI/Retail,RAPSYS TECHNOLOGIES PTE. LTD.,Information Technology,Senior,6000,8000,Tableau;Liaising with cross functional teams;Dashboards;Dashboard Construction;large datasets;Data Analysis;Querying Databases;Implementation of Best Practices;Maintenance of data integrity;Data Management;Translate Into Technical Requirements;SQL,"Key Responsibilities: Engage with business users and stakeholders to gather, understand, and document data and reporting requirements. Perform in-depth data analysis to identify trends, patterns, and actionable insights within retail datasets. Design, develop, and maintain interactive dashboards and reports using Tableau and Power BI. Transform complex data into intuitive visualizations tailored to business needs. Ensure data accuracy, consistency, and integrity across reports and dashboards. Collaborate with cross-functional teams to validate data and align outputs with business objectives. Conduct user acceptance testing (UAT), iterate based on feedback, and ensure successful deployment of dashboards. Provide post-deployment support and continuously enhance dashboards based on evolving requirements. Required Skills & Qualifications: Proven experience as a Data Analyst, preferably within the retail industry. Strong hands-on expertise in Tableau and Power BI (senior-level proficiency). Solid understanding of data analysis, data modeling, and visualization best practices. Ability to communicate effectively with business users and translate requirements into technical solutions. Expe",Islandwide,MyCareersFuture MCF-2026-1060811,2026-06-22,https://www.mycareersfuture.gov.sg/job/information-technology/data-analyst-tableaupowerbiretail-rapsys-technologies-e70f58dd59d9b82bfa790f53ba1fb505
Data Analyst (Advanced SQL) 12-months contract,OPTIMUM SOLUTIONS (SINGAPORE) PTE LTD,Information Technology,Junior,5000,5880,delivering KPIs;Dashboards;Analytics Support;Handling Queries;Design;Influencing;Business Operational Planning;Business Insights;Develop Recommendations;Service Strategy;Hive;Analytical Modelling,"Our client is a leading global technology company with a strong presence in digital platforms, innovation, and large-scale software systems. They are currently seeking a highly analytical and business-focused Data Analyst to drive data-driven decision-making, operational excellence, and strategic insights across a large-scale customer support and business operations environment. This is a 12-months contract role. Responsibilities Analyze large and complex datasets using SQL, Python/R, Tableau, Hive, Presto, and other big data technologies. Develop and execute data science and analytics initiatives that support business strategy and operational performance. Design, build, and maintain advanced analytical models, dashboards, and reporting frameworks to generate actionable insights. Partner with cross-functional stakeholders to identify opportunities, solve business challenges, and drive continuous improvement. Present data-driven recommendations and insights to both technical and non-technical audiences, including senior leadership. Establish scalable reporting systems, performance metrics, and KPIs to support operational efficiency and decision-making. Mentor analysts and contribute","D16 Bedok, Eastwood, Kew Drive, Upper East Coast",MyCareersFuture MCF-2026-1057350,2026-06-22,https://www.mycareersfuture.gov.sg/job/information-technology/data-analyst-12-months-contract-optimum-solutions-dd3c614f09ea0381208e579a9dbb4486
Data Analyst Intern,PSA MARINE (PTE) LTD,Others,Entry,1200,1200,Dashboards;Organisational Skills;Data Analysis;Data Management;VBA;Attention to Detail;Statistics;Power BI,"The intern will be attached to the Fleet Digital section and will support the team in the following activities: Extract and analyze sets of data from multiple sources and database for Harbour Launch, Tugs and Crew Deployment; develop and test hypothesis and communicate with section managers recommendations. Identify and interpret trends or patterns in the collected data sets. Detect anomalies, spot discrepancies and possible defects from our Fleet Management System Produce insights on operations data using analytic tools (Python/Excel/Power BI) Design, develop and maintain ongoing reports and dashboards. Take in the lead in digitalization projects by working with key stakeholders within and outside of organization. Perform any other ad-hocs duties as assigned. Preferred Skills Proficiency in Python Programming Language and Excel VBA Experience in UI/UX designing and able to develop dashboard with data visualization tools (Example: Power BI and Tableau) Analytical mindset driven to understand machinery and operation data Strong organizational and problem-solving skills Commitment to learning including new analytical methods and Harbour Craft profile Ability to identify data-driven i","D05 Pasir Panjang, Hong Leong Garden, Clementi New Town",MyCareersFuture MCF-2026-0870255,2026-06-22,https://www.mycareersfuture.gov.sg/job/others/data-analyst-intern-psa-marine-966c1abd654da9373b31e452604d3de0
Data Scientist,ALLEGIS GROUP SINGAPORE PRIVATE LIMITED,Information Technology,Mid,6000,11000,Dashboards;Sampling;Quality Control;NumPy;Large Scale Systems;Automation Tools;enhancing the features;Data Engineering;Performing;Design-Build;Python;Software Development,"We are looking for a talented Data Scientist to join a growing team within a global technology organisation, helping shape the future of AI quality operations . This role sits at the intersection of LLM / AI, data science, and quality engineering , ensuring that AI systems deliver reliable, accurate, and high-quality outputs at scale. This is a high-impact role supporting systems used by millions of users globally , where data integrity and model reliability are critical. About the Role You will be responsible for validating and improving outputs from LLM and machine learning models , while building scalable systems to ensure data quality and model reliability. Working closely with cross-functional teams, you will apply statistical methods, automation, and engineering best practices to strengthen AI quality processes. Key Responsibilities Audit and validate AI/LLM model outputs to ensure accuracy, consistency, and relevance Design and implement data quality metrics, sampling strategies, and audit frameworks Perform statistical analysis and anomaly detection to identify risks and improve output quality Build and enhance automation tools, dashboards, and self-serve platforms for qual",Islandwide,MyCareersFuture MCF-2026-0818240,2026-06-22,https://www.mycareersfuture.gov.sg/job/information-technology/data-scientist-allegis-group-singapore-80ed8a9f5ae9b5ffc83398f5a54fe209
Data Scientist,ALLEGIS GROUP SINGAPORE PRIVATE LIMITED,Information Technology,Senior,7000,10000,Tableau;website metrics;Media Asset Management;Process Improvement;Quality Assurance;strategic role;Transcribing;Copywriting;marketing report;Data Science,"Job Description & Requirements Big Tech company is seeking a Data Scientist based in Singapore and working reviewing and analysing data, training data, generating insights, and driving improvements in search and recommendation systems. You’ll collaborate closely with Data Scientists and Engineers, playing a key role in refining and enhancing Music, Podcasts and TV’s user experience. The Position: Ensure data quality is maintained at high standards and continually enhance processes based on both quantitative and qualitative feedback Quality assurance reviewing, verifying, editing, scoring, transcribing, copywriting, and reporting on data and/or assets across a broad scope of media and content types. Generating detailed reports that analyze issues and patterns for your market, offering insights to managers, statisticians, and engineers Analyzing metrics and query logs to identify and resolve data and relevance issues The Candidate: At least 1-4 years overall experience as a Data Analyst Data Visualization/dashboarding (Tableau or PowerBI experience) Python experience is a must LLM (Large language models) is required Professional proficiency in Mandarin is required as you'll be commut",Islandwide,MyCareersFuture MCF-2026-0543435,2026-06-22,https://www.mycareersfuture.gov.sg/job/information-technology/data-scientist-allegis-group-singapore-00db9ca7a65c64178acc18c771b2a2a9
Data Scientist - AI / ML,NSEARCH GLOBAL PTE. LTD.,Information Technology,Mid,8000,11000,TensorFlow;Machine Learning;AI Agents;Artificial Intelligence;OpenGL;OpenAI Codex;Python;Claude Code;3D Modelling;Agile Software Development,"Our client, one of Asia-Pacific’s leading organizations is looking for: Data Scientist Responsibilities: Work with product owners, engineering teams, and industry partners throughout the product development lifecycle from concept, design, prototyping, acceptance testing, data curation, delivery, operationalisation, industry proliferation, to product end-of-life Develop and deploy software components based on microservices-based architecture Participate in agile secure software development processes and best practices, documentation of user requirements and software codes during the software development lifecycle Propose, implement, and validate algorithms, ensuring functional and non-functional requirements Requirements: Degree in Engineering, Computer Science, Mathematics, Statistics or equivalent with strong technical knowledge in AI Good understanding of the latest research and technologies in AI for production deployment Strong coding experience in programming languages such as Python and/or C++ Experience working with libraries for data manipulation, visualization, machine learning, and reporting. Hands-on experience with one or more deep learning frameworks, e.g., TensorFlow,",Islandwide,MyCareersFuture MCF-2026-1061111,2026-06-22,https://www.mycareersfuture.gov.sg/job/information-technology/data-scientist-ai-ml-nsearch-global-2c3ca80452f23134b93587c3bf46ac06
Junior Data Scientist,NICOLL CURTIN TECHNOLOGY PTE. LTD.,Information Technology,Junior,4500,5800,Liaising with cross functional teams;Dashboards;Analytics Support;Exploratory Data Analysis;large datasets;Operational Excellence;R Programming;Science and Math;Business Decision Making;Computer Science;Operational Metrics;Technical Consultation,"Junior Data Scientist – Business Operations & Analytics Summary We are seeking a highly analytical and strategic Junior Data Scientist to drive data-led decision making across a large-scale customer and business operations environment. This role will focus on leveraging advanced analytics, reporting, and data modelling to uncover actionable insights, improve operational performance, and influence business strategy. The ideal candidate thrives in ambiguous environments, can independently manage complex cross-functional initiatives, and is passionate about transforming data into meaningful business outcomes. Responsibilities Develop and execute data science and analytics strategies that support business objectives and operational excellence. Design, build, and maintain advanced analytical models, prototypes, and frameworks to identify trends, opportunities, and performance improvements. Extract, process, and analyze large, complex datasets using SQL, Python, R, and Big Data technologies. Create and maintain scalable dashboards, reporting systems, KPIs, and operational metrics to support business performance monitoring. Translate complex analytical findings into clear, actionable reco","D01 Marina, Raffles Place, People's Park, Cecil",MyCareersFuture MCF-2026-1058155,2026-06-22,https://www.mycareersfuture.gov.sg/job/information-technology/junior-data-scientist-nicoll-curtin-technology-6cc41e339be9eaf2bfb1b295757ed5fb
Junior Data Scientist (AI focused) - 12 Months Contract - Up to SGD6k,MORGAN MCKINLEY PTE. LTD.,Information Technology,Junior,5000,6000,Tableau;Dashboards;Design;Data Storytelling;Business Operational Planning;Data Insight;R Programming;Monitoring team performances;Technological Proficiency;Stakeholder Engagement;Staff Continuous Learning;Hive,"We are looking for an experienced Data Scientist (AI focused) . In this role, you will drive impactful data initiatives across the organization. Key Responsibilities: Lead the development and implementation of data science strategies to support key business decisions and operational enhancements. Design, build, and deploy advanced analytical models using tools like SQL, Tableau, Hive, and Presto to derive actionable insights from large datasets. Mentor and collaborate with data scientists and analysts to foster a culture of continuous learning and analytical excellence. Communicate complex findings effectively to both technical and non-technical stakeholders, including senior leadership. Develop and maintain reporting systems, dashboards, and metrics to enable scalable and efficient operations, while driving innovation and process improvements.. Qualifications: Bachelor's degree required, along with 2-4 years of experience supporting operations in a technical environment. Strong understanding of operational metrics and KPIs to evaluate team success and performance. Technical proficiency in SQL, including creating, optimizing, and maintaining complex queries, as well as experience w",Islandwide,MyCareersFuture MCF-2026-1057228,2026-06-22,https://www.mycareersfuture.gov.sg/job/information-technology/junior-data-scientist-12-months-contract-sgd6k-morgan-mckinley-cfd5e5ac5ef4dadb7e9c5e7dcfcf551e
Product Manager,ALLIED TELESIS INTERNATIONAL (ASIA) PTE. LTD.,Telecommunications,Manager,10000,12500,Computer Engineering;Collaboration;product roadmap strategies;Product Lifecycle Management;Product Management;Engineering Skills;Product Development;Electrical Engineering;Product Development Lifecycle;Product Launch,"Job Summary: The Product Manager will play a pivotal role in driving the success of our software product offerings. This position is responsible for designing, developing and managing capabilities for a specific networking software from product definition and planning through production, release and end of life. Serves as the central resource with design, process, manufacturing, test, quality and marketing as the product(s) move to production and distribution. Essential Duties and Responsibilities: Leads, defines and develops features within Allied Telesis’ software products. Develop and maintain a comprehensive product roadmap that aligns with business objectives and market demands. Work closely with engineering and design teams to prioritize, define and deliver impactful product features. Lead the product launch process, coordinating with marketing, sales, and engineering teams to ensure successful execution. Conduct market research and competitive analysis to inform product positioning and identify opportunities for innovation. Collaborate with Sales and Marketing to drive product adoption, engagement, and revenue growth. Monitor product performance metrics and customer feedback","D19 Hougang, Sengkang, Serangoon Garden, Punggol",MyCareersFuture MCF-2026-1059319,2026-06-22,https://www.mycareersfuture.gov.sg/job/telecommunications/product-manager-allied-telesis-international-ae3a624bf7b290bcf7fa5a5c5f5b3d2e
"Product Manager, Trade Finance/ Receivables Finance",UNLOQ (SINGAPORE) PTE. LTD.,Banking and Finance,Mid,9000,15000,Product and Pricing Strategy Development;Product Innovation;Accounts Payableandrecievable;New Product Ideas;Risk Control and Response Planning;product roadmap strategies;Product Design;Resolving Client Issues;Sales Experience;Social Policy Development;Identify product opportunities;company publications,"About Unloq: Unloq is part of LinklogisGroup, an award-winning leader in supply chain finance. With deep expertise inserving major buyers in North America, Europe and Asia, Unloq makes tradefinancing simple across global corridors. We’ve built unique knowledge andexpertise that allows us to move faster, improve processes, and deliver smarterfinancial solutions. Our platform helps buyers unlock working capital whileenabling suppliers to get paid earlier, creating a flywheel that acceleratesgrowth for everyone. With our purpose-builtsolutions and industry-leading technology infrastructure, we are able todeliver tangible benefits to various stakeholders in the supply chain financeecosystem with profound influence in reshaping the supply chain finance sector.We focus on providing world-class solutions for enterprises and financialinstitutions to meet their evolving business and technology needs, helping themdeliver superior user experience for their SMEs. The Role: Weare looking for a commercially minded Product Manager to help drive the nextphase of product growth across our trade finance and supply chain financebusiness. TheProduct Manager will own product thinking from market needs ","D01 Marina, Raffles Place, People's Park, Cecil",MyCareersFuture MCF-2026-1058130,2026-06-22,https://www.mycareersfuture.gov.sg/job/banking-finance/product-manager-trade-finance-receivables-finance-unloq-7244dd41f91e5c1a84ff7d0b6543ff60
Product Manager(VCC/API/FX/Payments),AMBITION GROUP SINGAPORE PTE. LTD.,Banking and Finance,Junior,6000,15000,Settlement;Technology Expertise;transaction flow;Platform Modernization;Credit Card Industry;Fast-paced;Clear-One;Digital Banking;Trade Life Cycle;B2B;Product Management;Authorization,"About the Role： 4 headcounts for Payment 1 headcount for VCC 1 headcount for API 1 headcount for FX We are seeking a strategically minded, execution-driven Senior Product Manager to own and advance a portfolio of critical payment and financial infrastructure products spanning consumer & business payments, API integrations, card issuance (virtual ）, and FX/OTC trading solutions . Payment Products (App & Web) Define and execute the product strategy and roadmap for MetaComp’s mobile and web payment platforms , delivering seamless, intuitive user experiences for fiat and digital-asset-linked transactions. Drive end-to-end product development from concept and UX design through build, testing, and deployment; translate complex regulatory requirements into clear, user-friendly product solutions. Define and optimise product KPIs, user experience metrics, and funnel performance using analytics and user feedback. Collaborate with Sales and Marketing on go-to-market planning, value propositions, and client-facing documentation. API & Infrastructure Products Own Backbone API integrations that connect payment service providers, FX, settlement, and custody workflows to internal systems. Manage t","D01 Marina, Raffles Place, People's Park, Cecil",MyCareersFuture MCF-2026-1063047,2026-06-22,https://www.mycareersfuture.gov.sg/job/banking-finance/product-manager-ambition-group-singapore-18b3fc88ba1dbcb9ef288bb26719d485
Product Manager/ Product Owner,TRIDENT DIGITAL TECH PTE. LTD.,Others,Manager,4600,5600,Market Research;Competitive Analysis;Liaising with cross functional teams;Product Design and Development;Data Analysis;Evangelism;Product Design;Usability Testing;Agile;Product Management;Engineering Design;User Testing and Usability Testing,"A Product Manager is responsible for the direction, coordination, implementation, executive, control and completion of the project while remaining aligned with the strategy, commitments and goals of the project. Responsibilities: Product Strategy: Developing a strategic vision and roadmap for the product, aligning it with the overall business goals and objectives. Conducting market research, competitive analysis, and gathering customer feedback to identify market opportunities and define the product’s value proposition. Product Planning and Definition: Collaborating with cross-functional teams, such as engineering, design and marketing, to define the product requirements, features, and functionality. Creating and maintaining product specifications and documentation. Product Management: Leading the product development process, including prioritising features, setting timelines, and managing the product development lifecycle. Coordinating with engineering, design, and other teams to ensure timely and quality delivery of the product. Stakeholder Management: Engaging with stakeholders, such as executives, customers, sales teams, and support teams, to gather feedback, understand require","D01 Marina, Raffles Place, People's Park, Cecil",MyCareersFuture MCF-2026-0756015,2026-06-22,https://www.mycareersfuture.gov.sg/job/others/product-manager-product-owner-trident-digital-tech-85bef2c17528b69030271cdb0f37bec9
Senior Control Software Engineer (Space Laser Communications),TRANSCELESTIAL TECHNOLOGIES PTE. LTD.,Engineering,Mid,9000,16000,ROS;Aerospace Engineering;Software Requirement Specification;Laser and Optics Application;Hardware;ADCs;Signal Processing Algorithms;STK;Control System Design;Analytical and Problem-Solving Skills;Simulink;MATLAB,"Summary Transcelestial’s vision is to improve the connectivity experience for the next billion people. We believe that connectivity is a human right and Transcelestial is on a mission to solve the problem of internet distribution and provide affordable, high-speed internet to everyone. Transcelestial’s next-generation wireless laser communication technology is one of the most effective solutions in the distribution of high-quality, high-speed internet connectivity, making it well-poised to solve civilization’s long-term communication needs - and ultimately improve connectivity for 1 billion users globally. Highly reliable and secure, its light-weight, shoe-box sized CENTAURI device leverages its proprietary laser technology to create a wireless distribution network and can be quickly, easily and cost-effectively installed on any standard telecom pole or tower at a faster time-to-market than standard fiber-optic cable. Over the longer-term, Transcelestial aims to develop a constellation of small satellites positioned in Low Earth Orbit, allowing their laser network to not only beam across cities but upwards to connect continents across the world too. Our Values L ean & Simple. Our p","D14 Geylang, Eunos",MyCareersFuture MCF-2026-1058890,2026-06-22,https://www.mycareersfuture.gov.sg/job/engineering/senior-control-software-engineer-transcelestial-technologies-f0f37358b687bfd8c1443b22db163fd2
Senior Software Engineer,DELL GLOBAL B.V. (Singapore Branch),Information Technology,Mid,9000,13000,Microsoft PowerPoint;on-the-job training;CSS;Windows 10;Multimedia;.NET;Software Engineering;Technological Proficiency;User Training;Mobile Devices;Instructional Design;C#,"Software Senior Engineer, Software Engineering The Software Engineering team delivers next-generation application enhancements and new products for a changing world. Working at the cutting edge, we design and develop software for platforms, peripherals, applications and diagnostics — all with the most advanced technologies, tools, software engineering methodologies and the collaboration of internal and external partners. Join us to do the best work of your career and make a profound social impact as a Senior Software Engineer on our Software Engineering Team in Singapore. What you’ll achieve As a Senior Software Engineer, you will be responsible for the technical support of factory test process and software that apply to Client and Server products being built. You will: Collect issue category data and drive back to issue owners not only to solve the issue, but also improve process gaps and test coverage. Contribute to the design and architecture of new or re-engineered software/storage environments to accomplish the goals of PCBA boards manufacturing testing. Prepare written software/storage specifications for sophisticated products from architectural diagrams and documents Build a","D16 Bedok, Eastwood, Kew Drive, Upper East Coast",MyCareersFuture MCF-2026-1057754,2026-06-22,https://www.mycareersfuture.gov.sg/job/information-technology/senior-software-engineer-dell-global-bv-9976284e62b7a6f64f5dca2565296da4
