title,company,industry,seniority,min,max,skills,description,location,source,posted,url
Lead Data Scientist,ANCHOR SEARCH GROUP PTE. LTD.,Information Technology,Senior,13000,16500,Competency Mapping;Data Handling;AI Agents;Apache Spark;Analytical Skills;Natural Language Processing;Quantitative Analysis;Artificial Intelligence;Workflow Analysis;Model Validation;software lifecycle methodologies;Python,"We are looking for a data scientist to address challenging data science problems by discovering information hidden in vast amount of data by leveraging techniques in statistics, machine learning, and data mining. The data scientist will work closely with the business users, project managers, and database engineers to develop sophisticated analytics algorithms that provide actionable insights. The role requires to a trusted adviser to our clients in conceptualizing advanced analytics solutions and enabling their journey in data science. Responsibilities: -Translate customer pain-points into problem statements, architect analytics solution, and engagingly present results and learnings to both technical and non-technical audiences. - Develop and manage entire end-to-end lifecycle of scoping of data inputs, data cleaning and pre-processing, feature engineering, building models, deploying to production and improving models by iterations - Present statistically sound model validations to justify model selection and performance - Build and deploy highly valuable, efficient, scalable advanced analytics models in production systems - Design and develop sophisticated visualizations and dashb",Islandwide,MyCareersFuture MCF-2026-1105682,2026-06-29,https://www.mycareersfuture.gov.sg/job/information-technology/lead-data-scientist-anchor-search-group-12933b04ee2b4c23381cc81214ba706b
PowerBI Data Analyst - 6 Months Contract,MANPOWER STAFFING SERVICES (SINGAPORE) PTE LTD,Information Technology,Senior,7500,8600,Tableau;DB2/SQL;CSS;analyse supply chain data;application troubleshooting;Data Engineering;SharePoint;Database Management;SQL Development;Powerapps;Power BI;MySQL DBA,"Reporting into the Supply Chain Services Manager, Supply Chain Services Team is responsible for the design, deployment and adherence to key systems, tools and processes used by our client’s Global Supply Chain Teams. As a key member of this dedicated team, you’ll play a vital role in managing and enhancing these systems and processes, ensuring that they effectively empower our client’s Global Supply Chain operations. As a key member of the team, you will ensure the seamless operation and improvement of our client’s Supply Chain Services Programs. Reporting directly to Supply Chain Services as an individual contributor, you will play a pivotal role in maintaining, supporting, and advancing our client’s applications. Job Responsibilities Maintenance and Support • Develop new and maintain or update existing Power Apps and Power Automate flows for peak performance. • Keep a close eye on application health, addressing issues swiftly and implementing enhancements. • Identify and evaluate opportunities for improvement, ensuring accuracy in data and reports. Issue Resolution • Provide expert assistance to associates using Power Apps, Power Automate flows, Power BI, and SharePoint. • Diagno","D02 Anson, Tanjong Pagar",MyCareersFuture MCF-2026-1105819,2026-06-29,https://www.mycareersfuture.gov.sg/job/information-technology/powerbi-data-analyst-6-months-contract-manpower-staffing-services-a65d32660f0e15f192cd60166e68fae5
Product Manager - Research & Insights,ALPHA ESS INTERNATIONAL PTE. LTD.,Information Technology / Wholesale Trade,Mid,7000,18000,Independent Research;Information Gathering and Analysis;Market Trend Analysis;Analyticalandresearch Skills;Data Insight;Energy Storage Technologies;Competency Management;Market Strategy;Energy;Market Opportunity Analysis;Computer Science;Product Management,"Why This Role Exists AlphaESS is a global energy storage solutions provider, with core business covering residential and small commercial & industrial (C&I) energy storage systems. Our cloud platform serves as the core system for monitoring, scheduling, operations, and data analytics, continuously serving users, installers, and partners across different regions worldwide. To strengthen insight-driven product decision-making, we are establishing a Product Manager - Research & Insights position in Singapore. This role will focus on market research, competitive analysis, user insights, and industry trend research, providing continuous research support and strategic input to the product team. What You Will Do 1. Competitive Monitoring & Analysis · Establish and maintain competitive monitoring mechanisms · Deliver regular competitive analysis reports, identifying market opportunities and threats · Track competitor product updates, feature releases, and market strategies 2. Market Trend Research · Research energy storage industry trends, policy changes, and emerging technologies · Analyze characteristics and demand differences across regional markets · Provide market insights and trend a","D05 Pasir Panjang, Hong Leong Garden, Clementi New Town",MyCareersFuture MCF-2026-1103827,2026-06-29,https://www.mycareersfuture.gov.sg/job/information-technology/product-manager-research-insights-alpha-ess-international-0ba7cb004f5457075440a79612d59f97
Product Manager (Cybersecurity Solutions),JJ CONSULTING SERVICES,Information Technology,Senior,10000,14000,Security Operations;Security Governance;Cross-Functional Team Leadership;Collaborating With Product Managers;product roadmap strategies;Exploitation;Product Lifecycle Management;Strategic Management;Web Applications;Customer Requirements Analysis;Stakeholder Engagement and Management;Stakeholder Management,"​ Our Client is an established company in Singapore, who is seeking to recruit a Product Manager (Cybersecurity Solutions), to drive user engagement and stakeholder management for cybersecurity solutions. This role is instrumental in shaping product strategy, understanding user needs, measuring product impact, and translating security requirements into valuable features. You will lead sprint ceremonies and workhand-in-hand with development teams to drive continuous improvement and delivery excellence. The role involves facilitating agile ceremonies, managing sprint backlogs, and fostering a culture of iterative development while collaborating with cross-functional teams to manage and develop cybersecurity solutions. You are also required to take on product management responsibilities, including strategic roadmap planning and continuous security posture assessment. Responsibilities Strategic Product Management: · Partner with lead Product/Programme Manager to develop and execute product strategy and vision · Own and drive specific product features or components of the cybersecurity solution · Develop and maintain product road map in alignment with overall strategy · Conduct market r",Islandwide,MyCareersFuture MCF-2026-0961052,2026-06-29,https://www.mycareersfuture.gov.sg/job/information-technology/product-manager-jj-consulting-services-20906b561201a6996c9ad4f5e273e8e7
Salesforce Data Analyst,CAPGEMINI SINGAPORE PTE. LTD.,Consulting / Information Technology,Junior,5500,7500,UAT;Integration Management;Data Orchestration;Data Structures;Data Integration;Field Operations;Technical Requirements Gathering;Defect Tracking;Collaboration Solutions;User Acceptance Testing;System Integration Testing;Software Integration,"Company Overview Capgemini is an AI-powered global business and technology transformation partner with 420,000 team members in 50+ countries. We deliver end-to-end services leveraging deep industry expertise and a strong partner ecosystem to create tangible business value. Make it real | www.capgemini.com Job Summary We are seeking a Salesforce Data Analyst to support data integration initiatives across Salesforce and external systems. The role focuses on data mapping, integration support, and testing within enterprise environments. Responsibilities Support data mapping between Salesforce and external systems using APIs to ensure accurate data integration Analyse data structures, fields, and relationships across platforms to identify integration requirements and issues Prepare and maintain detailed data mapping documents and integration specifications for cross-team use Review API payloads such as JSON and XML to validate data formats and support integration accuracy Support System Integration Testing (SIT) and User Acceptance Testing (UAT) by validating data and tracking defects Assist in gathering and documenting integration requirements to align technical solutions with business","D01 Marina, Raffles Place, People's Park, Cecil",MyCareersFuture MCF-2026-1103212,2026-06-29,https://www.mycareersfuture.gov.sg/job/consulting/salesforce-data-analyst-capgemini-singapore-fcd2ebf459bb867bc073a67c96c74679
Senior Business Analyst - Front Office,LUXOFT SINGAPORE PTE. LTD.,Information Technology,Senior,10000,13500,Requirements Gathering;Derivatives;Technical Skills;Structured Products;Interpersonal Skills;Front Office Trading;SharePoint;JIRA;Application Support;Python;User Acceptance Testing;Experienced Business Analyst,"Project details Our client is the corporate and investment banking arm of The Group, world's 10th largest bank by total assets. Their Singapore center is the 2nd largest IT setup (after Paris head office) for their worldwide business. They work daily with international branches located in 30 markets by: • Envisioning and preparing the Bank's futures information systems. • Partnering and supporting core banking flagships and transverse areas in their large-scale development projects. • Providing premium In-house Banking applications, • This unique positioning empowers us to bring our core banking business a sustainable competitive advantage on the market. We seek innovative and agile people sharing our mindset to support ambitious and forthcoming technological challenges. We are seeking a talented Business Analyst in front office, project mode as well as maintenance, and to support the ""run the bank"" function. It requires a deep understanding of the nature of business operations, timing of activities & data flowing through internal and external systems. The build and support team continuously works with business users, infrastructure engineers and system managers. The Business analy","D04 Harbourfront, Sentosa Island, Telok Blangah",MyCareersFuture MCF-2026-1107606,2026-06-29,https://www.mycareersfuture.gov.sg/job/information-technology/senior-business-analyst-front-office-luxoft-singapore-15b3eac5aeecf2bfbe36911ab46c5cfa
Senior Lead Software Engineer – Java - Asset Management Trading,JPMORGAN ASSET MANAGEMENT (SINGAPORE) LIMITED,Banking and Finance / Information Technology,Senior,11000,22000,Creative Problem Solving;Idea Generation;Architectural Patterns;Scalability;Software Training;Java Applications;Mentoring for Developers;Computer Science;Issue Handling;Core Java;Liaise With Traders;Asset Trading,"As a Senior Lead Software Engineer within Asset Management Trading Technology, you will help transform trading. You will design, build, and evolve industry-leading platforms that manage orders and execute trades across diverse asset classes. Working closely with Traders, you will support critical applications in production and engineer solutions that automate and optimize the order management lifecycle. You will be part of a team that values technical excellence, creative problem-solving, and rapid delivery, where your expertise will directly shape the future of trading technology. Job Responsibilities: • Support critical applications in production, interacting directly with users to resolve issues • Design and engineer scalable, high-performance trading systems across multiple asset classes. • Collaborate directly with Traders to deliver impactful solutions. • Build and develop core Java applications for mission-critical trading platforms. • Architect and implement next-generation messaging and streaming technologies such as Kafka and AMPS. • Drive technical innovation and contribute creative ideas for platform advancement. • Drive the adoption and scaling of GenAI practices withi",Islandwide,MyCareersFuture MCF-2026-1109194,2026-06-29,https://www.mycareersfuture.gov.sg/job/banking-finance/senior-lead-software-engineer-%E2%80%93-java-asset-management-trading-jpmorgan-asset-management-8bdfa75acb497208d9de1e1734d685f8
Senior Product Manager,DOCTOR WORLD PTE. LTD.,Healthcare / Pharmaceutical / Information Technology,Senior,7500,9000,Market Research;Cross-Functional Team Leadership;Methodology;Product Evangelism;Digital Products;Product Management;Product Demonstration;Product Development;collaborate with external team;Stakeholder Management;Agile & Waterfall Methodologies;Product B2b,"About the Role Doctor World is seeking an experienced, strategic, and ownership-minded Senior Product Manager to lead a key area of our growing product team. In this role, you will serve as a strategic leader who collaborates with key external partners, guides product development through flexible methodologies, and delivers innovative healthcare & wellness solutions that address complex user needs. You will be a leader in shaping the future of our products, responsible for driving product strategy and delivering exceptional user experiences that improve lives. Key Responsibilities Product Strategy & Partner Vision Collaborate with key external partners to understand, influence, and align with their long-term product strategy. Champion innovation based on deep user needs, market research, and data. Translate complex partner strategies into detailed product specifications and user stories. Stakeholder Management & Leadership Act as the primary point of contact for the product area, communicating vision and progress to internal and external stakeholders (including C-level). Lead and unite cross-functional teams to ensure successful product launches. Evangelize the product's value prop","D07 Middle Road, Golden Mile",MyCareersFuture MCF-2026-1102399,2026-06-29,https://www.mycareersfuture.gov.sg/job/healthcare/senior-product-manager-doctor-world-483fe8238918451cea96a8e846aee04c
SMAI Data Scientist,MICRON SEMICONDUCTOR ASIA OPERATIONS PTE. LTD.,Engineering,Entry,4900,8400,Git;CSS;Linear Programming;Semiconductor Industry;Client Services;Data and Statistical Analysis;Industrial Engineering;ETL;Computer Science;Capability Development;Mathematical Programming;Cloud Services,"As a Data Science Engineer at Micron, you will employ techniques and theories drawn from areas of mathematics, statistics, semiconductor physics, materials science, and information technology to uncover patterns in data from which predictive models, actionable insights, and solutions can be developed. You will interact with experienced Data Scientists, Data Engineers, Business Areas Engineers, and UX teams to identify questions and issues for data analysis projects and improvement of existing tools. In this position, you will help develop software programs, algorithms and/or automated processes to cleanse, integrate, and evaluate large datasets from multiple disparate sources. There will be significant opportunities to perform exploratory and new solution development activities. Responsibilities include, but not limited to: Design, develop, and program methods, processes, and systems to consolidate and analyze unstructured, diverse “big data” sources to generate actionable insights and solutions for client services and product enhancement. Interact with product and service teams to identify questions and issues for data analysis and experiments. Develop and code software programs, ","D25 Kranji, Woodgrove, Woodlands",MyCareersFuture MCF-2026-1102522,2026-06-29,https://www.mycareersfuture.gov.sg/job/engineering/smai-data-scientist-micron-semiconductor-asia-operations-27d66aeb6f4b049f6a95f48d48a12aa4
SMAI Senior Data Scientist,MICRON SEMICONDUCTOR ASIA OPERATIONS PTE. LTD.,Engineering,Entry,6600,11400,Git;CSS;Linear Programming;Data and Statistical Analysis;Industrial Engineering;ETL;Computer Science;Analytical and Problem-Solving Skills;Capability Development;Mathematical Programming;Cloud Services;Java,"As a Data Science Engineer at Micron, you will employ techniques and theories drawn from areas of mathematics, statistics, semiconductor physics, materials science, and information technology to uncover patterns in data from which predictive models, actionable insights, and solutions can be developed. You will interact with experienced Data Scientists, Data Engineers, Business Areas Engineers, and UX teams to identify questions and issues for data analysis projects and improvement of existing tools. In this position, you will help develop software programs, algorithms and/or automated processes to cleanse, integrate, and evaluate large datasets from multiple disparate sources. There will be significant opportunities to perform exploratory and new solution development activities. Responsibilities include, but not limited to: Design, develop, and program methods, processes, and systems to consolidate and analyze unstructured, diverse “big data” sources to generate actionable insights and solutions for client services and product enhancement. Interact with product and service teams to identify questions and issues for data analysis and experiments. Develop and code software programs, ","D25 Kranji, Woodgrove, Woodlands",MyCareersFuture MCF-2026-1102560,2026-06-29,https://www.mycareersfuture.gov.sg/job/engineering/smai-senior-data-scientist-micron-semiconductor-asia-operations-6b3346e77b012a4c7f438b7d671a74d1
SMAI Senior Data Scientist,MICRON SEMICONDUCTOR ASIA OPERATIONS PTE. LTD.,Engineering,Entry,6600,11400,Git;CSS;Linear Programming;Semiconductor Industry;Client Services;Data and Statistical Analysis;Industrial Engineering;ETL;Computer Science;Optimization Design;Capability Development;Cloud Services,"As a Data Science Engineer at Micron, you will employ techniques and theories drawn from areas of mathematics, statistics, semiconductor physics, materials science, and information technology to uncover patterns in data from which predictive models, actionable insights, and solutions can be developed. You will interact with experienced Data Scientists, Data Engineers, Business Areas Engineers, and UX teams to identify questions and issues for data analysis projects and improvement of existing tools. In this position, you will help develop software programs, algorithms and/or automated processes to cleanse, integrate, and evaluate large datasets from multiple disparate sources. There will be significant opportunities to perform exploratory and new solution development activities. Responsibilities include, but not limited to: Design, develop, and program methods, processes, and systems to consolidate and analyze unstructured, diverse “big data” sources to generate actionable insights and solutions for client services and product enhancement. Interact with product and service teams to identify questions and issues for data analysis and experiments. Develop and code software programs, ","D25 Kranji, Woodgrove, Woodlands",MyCareersFuture MCF-2026-1102543,2026-06-29,https://www.mycareersfuture.gov.sg/job/engineering/smai-senior-data-scientist-micron-semiconductor-asia-operations-070b6e608ef6d6b0017fb543be682897
Software Engineer,TERADYNE (ASIA) PTE. LTD.,Engineering,Mid,6000,10000,UML;Software Engineering;Team Problem Solving;Designing software systems;Customer Escalation Management;VC;Software Design;Production Environment;C#;Hardware Testing;C++,"Our Purpose Teradyne is where experience meets innovation, driving excellence in every connection. We are fueled by creativity and diversity of thought across our workforce. Our employees are empowered to innovate and learn something new every day. We cultivate a culture of inclusion for all employees that respects their individual strengths, views, and experiences. We believe that our differences enable us to be a better team—one that makes better decisions, drives innovation, and delivers better business results. Opportunity Overview The Software Engineer (Sustaining) will debug, analyze, and develop software solutions to address customer issues on Teradyne’s UltraFLEX and UltraFLEXplus platforms within the IG-XL software environment. This role works closely with field support, product engineering, and other cross-functional teams to investigate complex technical issues, drive timely resolution, and support customer deployments. Debug, analyze, and develop software fixes or enhancements for customer-reported issues across UltraFLEX and UltraFLEXplus platforms. Support complex customer escalations by partnering with field teams, product teams, and other engineering organizations t",Islandwide,MyCareersFuture MCF-2026-1106832,2026-06-29,https://www.mycareersfuture.gov.sg/job/engineering/software-engineer-teradyne-f2f922e03ed4fb31b6f3a41508cc7d39
Software Engineer / Senior Software Engineer,CAPCON SINGAPORE PTE. LTD.,Engineering,Mid,3500,6500,Troubleshooting;Hardware;Software Engineering;JavaScript;Electrical;Windows OS;SQL;Python;Software Design;Java;Software Development;Able To Work Independently,"Job Responsibilities: · Software sustaining and continuous improvement of current machine’s software. · Responsible for software feature development and enhancement based on customer requirements. · Provide supporting and troubleshooting to on-site software issues. · Review and update the user requirement documents and operation procedures. · Collaborate with mechanical, electrical, application team to implement new hardware feature or software feature to equipment. · Develop and enhance software utilities to improve equipment setup and easy operating abilities Requirements: · Require BS or MS in Electrical/ Electronic/ Computer Engineering or equivalent. · Proficient in C, C++ programming with Windows OS. · Experience in PC-based control programming. · Able to work independently with good interpersonal, verbal and written communication skills. · Requires minimum of 3 years relevant experience in software development. · Require travel regionally. · Experiences in similar kind of project will be advantageous. · Knowledge in real time control system, object oriented software design Methodologies and database Technologies. · Good knowledge with vision, motion and Secsgem would be assi","D25 Kranji, Woodgrove, Woodlands",MyCareersFuture MCF-2026-1103540,2026-06-29,https://www.mycareersfuture.gov.sg/job/engineering/software-engineer-senior-software-engineer-capcon-singapore-8294774a646985ae2eaa24044c8538a6
System Software Engineer / Product Engineer,VY SYSTEMS PTE. LTD.,Information Technology,Senior,4750,5000,Device Driver;Device Driver Development;Design;Computer Engineering;liaison with design teams;Product Lifecycle Management;Computer Science;Bios;Systems Compliance;Windows OS;Firmware;Teaching Experience,"Role Summary The System Software Engineer / PE is a hybrid engineering role responsible for system software governance, platform integration, and end-to-end quality, performance, and process excellence. This role bridges hands-on technical execution (BIOS, firmware, OS, drivers) with quality and engineering functions, ensuring high-quality system software delivery across platforms and ODMs. The engineer works cross-functionally with BIOS, EC, OS, driver teams, hardware, validation, ODMs, and suppliers to drive robust design, efficient development processes, and measurable quality outcomes. Key Responsibilities 1. System Software Engineering Design, develop, integrate, and debug system software components, including:OS-level components and platform enabling drivers Hardware abstraction and system-level integrations Analyze system-level issues across hardware, firmware, OS, and drivers, and drive root-cause resolution. Collaborate with internal teams and ODM partners on design reviews and integration readiness. Support platform bring-up, feature enablement, and sustaining activities across multiple product generations. Ensure compliance with system software standards, security requir",Islandwide,MyCareersFuture MCF-2026-0908901,2026-06-29,https://www.mycareersfuture.gov.sg/job/information-technology/system-software-engineer-product-engineer-vy-systems-617c7186b4f5e976174a69a4129678df
